{
  "canvas": {
    "x": 0,
    "y": 0,
    "w": 1700,
    "h": 900
  },
  "nodes": [
    {
      "id": "b_sine_wave_function",
      "source_fact_id": "1",
      "component_key": "generic_block",
      "label": "Sine Wave Function",
      "label_bindings": {
        "main": "Sine Wave Function"
      },
      "orientation": "right",
      "geometry": {
        "x": 40.0,
        "y": 255.0,
        "w": 85.0,
        "h": 70.0
      },
      "ports": {},
      "style": {
        "mx_style": "text;html=1;align=center;verticalAlign=middle;fontFamily=Times New Roman;fontSize=30;fontStyle=1;strokeColor=none;fillColor=none;"
      }
    },
    {
      "id": "b_input_sum",
      "source_fact_id": "2",
      "component_key": "sum_inline",
      "label": "",
      "label_bindings": {
        "main": ""
      },
      "orientation": "right",
      "geometry": {
        "x": 170.0,
        "y": 295.45,
        "w": 48.0,
        "h": 48.0
      },
      "ports": {},
      "style": {}
    },
    {
      "id": "b_add",
      "source_fact_id": "3",
      "component_key": "sum_inline",
      "label": "",
      "label_bindings": {
        "main": ""
      },
      "orientation": "right",
      "geometry": {
        "x": 330.0,
        "y": 291.95,
        "w": 55.0,
        "h": 55.0
      },
      "ports": {},
      "style": {}
    },
    {
      "id": "b_unit_delay",
      "source_fact_id": "4",
      "component_key": "generic_block",
      "label": "Unit Delay",
      "label_bindings": {
        "main": "Unit Delay"
      },
      "orientation": "right",
      "geometry": {
        "x": 455.0,
        "y": 240.0,
        "w": 70.0,
        "h": 70.0
      },
      "ports": {},
      "style": {}
    },
    {
      "id": "b_k1",
      "source_fact_id": "5",
      "component_key": "gain_inline",
      "label": "K1",
      "label_bindings": {
        "main": "K1"
      },
      "orientation": "right",
      "geometry": {
        "x": 365.0,
        "y": 295.45,
        "w": 60.0,
        "h": 48.0
      },
      "ports": {},
      "style": {}
    },
    {
      "id": "b_add1",
      "source_fact_id": "6",
      "component_key": "sum_inline",
      "label": "",
      "label_bindings": {
        "main": ""
      },
      "orientation": "right",
      "geometry": {
        "x": 660.0,
        "y": 291.95,
        "w": 55.0,
        "h": 55.0
      },
      "ports": {},
      "style": {}
    },
    {
      "id": "b_unit_delay1",
      "source_fact_id": "7",
      "component_key": "generic_block",
      "label": "Unit Delay1",
      "label_bindings": {
        "main": "Unit Delay1"
      },
      "orientation": "right",
      "geometry": {
        "x": 785.0,
        "y": 240.0,
        "w": 70.0,
        "h": 70.0
      },
      "ports": {},
      "style": {}
    },
    {
      "id": "b_k2",
      "source_fact_id": "8",
      "component_key": "gain_inline",
      "label": "K2",
      "label_bindings": {
        "main": "K2"
      },
      "orientation": "right",
      "geometry": {
        "x": 690.0,
        "y": 295.45,
        "w": 60.0,
        "h": 48.0
      },
      "ports": {},
      "style": {}
    },
    {
      "id": "b_gain",
      "source_fact_id": "9",
      "component_key": "gain_inline",
      "label": "1",
      "label_bindings": {
        "main": "1"
      },
      "orientation": "right",
      "geometry": {
        "x": 700.0,
        "y": 296.95,
        "w": 60.0,
        "h": 45.0
      },
      "ports": {},
      "style": {}
    },
    {
      "id": "b_gain1",
      "source_fact_id": "10",
      "component_key": "gain_inline",
      "label": "2",
      "label_bindings": {
        "main": "2"
      },
      "orientation": "right",
      "geometry": {
        "x": 700.0,
        "y": 296.95,
        "w": 60.0,
        "h": 45.0
      },
      "ports": {},
      "style": {}
    },
    {
      "id": "b_output_sum",
      "source_fact_id": "11",
      "component_key": "sum_inline",
      "label": "",
      "label_bindings": {
        "main": ""
      },
      "orientation": "right",
      "geometry": {
        "x": 980.0,
        "y": 291.95,
        "w": 55.0,
        "h": 55.0
      },
      "ports": {},
      "style": {}
    },
    {
      "id": "b_3_bit_quantizer",
      "source_fact_id": "12",
      "component_key": "one_bit_quantizer_inline",
      "label": "",
      "label_bindings": {
        "main": ""
      },
      "orientation": "right",
      "geometry": {
        "x": 1070.0,
        "y": 281.95,
        "w": 95.0,
        "h": 75.0
      },
      "ports": {},
      "style": {}
    },
    {
      "id": "b_to_workspace",
      "source_fact_id": "13",
      "component_key": "generic_block",
      "label": "To Workspace",
      "label_bindings": {
        "main": "To Workspace"
      },
      "orientation": "right",
      "geometry": {
        "x": 1220.0,
        "y": 255.0,
        "w": 110.0,
        "h": 55.0
      },
      "ports": {},
      "style": {
        "mx_style": "text;html=1;align=center;verticalAlign=middle;fontFamily=Times New Roman;fontSize=30;fontStyle=1;strokeColor=none;fillColor=none;"
      }
    },
    {
      "id": "b_dwa",
      "source_fact_id": "14",
      "component_key": "generic_block",
      "label": "DWA",
      "label_bindings": {
        "main": "DWA"
      },
      "orientation": "right",
      "geometry": {
        "x": 980.0,
        "y": 505.0,
        "w": 90.0,
        "h": 90.0
      },
      "ports": {},
      "style": {}
    },
    {
      "id": "b_gain4",
      "source_fact_id": "15",
      "component_key": "gain_inline",
      "label": "1",
      "label_bindings": {
        "main": "1"
      },
      "orientation": "right",
      "geometry": {
        "x": 470.0,
        "y": 296.95,
        "w": 60.0,
        "h": 45.0
      },
      "ports": {},
      "style": {}
    }
  ],
  "edges": [
    {
      "id": "e_line_0",
      "source": "b_sine_wave_function",
      "target": "b_input_sum.in1",
      "targets": [
        "b_input_sum.in1"
      ],
      "route": {
        "style": "orthogonal",
        "source_xy": [
          125.0,
          290.0
        ],
        "target_xy": [
          170.0,
          319.45
        ],
        "waypoints": [
          [
            125.0,
            319.45
          ]
        ],
        "stroke_width": 3
      }
    },
    {
      "id": "e_line_1",
      "source": "b_input_sum.out1",
      "target": "b_add.in1",
      "targets": [
        "b_add.in1"
      ],
      "route": {
        "style": "orthogonal",
        "source_xy": [
          218.0,
          319.45
        ],
        "target_xy": [
          330.0,
          319.45
        ],
        "waypoints": [],
        "stroke_width": 3
      }
    },
    {
      "id": "e_line_2",
      "source": "b_add.out1",
      "target": "b_unit_delay.in1",
      "targets": [
        "b_unit_delay.in1"
      ],
      "route": {
        "style": "orthogonal",
        "source_xy": [
          385.0,
          319.45
        ],
        "target_xy": [
          455.0,
          275.0
        ],
        "waypoints": [
          [
            385.0,
            275.0
          ]
        ],
        "stroke_width": 3
      }
    },
    {
      "id": "e_line_3",
      "source": "b_unit_delay.out1",
      "target": "b_add1.in1",
      "targets": [
        "b_add1.in1"
      ],
      "route": {
        "style": "orthogonal",
        "source_xy": [
          525.0,
          275.0
        ],
        "target_xy": [
          660.0,
          319.45
        ],
        "waypoints": [
          [
            525.0,
            319.45
          ]
        ],
        "stroke_width": 3
      }
    },
    {
      "id": "e_line_4",
      "source": "b_add1.out1",
      "target": "b_unit_delay1.in1",
      "targets": [
        "b_unit_delay1.in1"
      ],
      "route": {
        "style": "orthogonal",
        "source_xy": [
          715.0,
          319.45
        ],
        "target_xy": [
          785.0,
          275.0
        ],
        "waypoints": [
          [
            715.0,
            275.0
          ]
        ],
        "stroke_width": 3
      }
    },
    {
      "id": "e_line_5",
      "source": "b_unit_delay1.out1",
      "target": "b_output_sum.in3",
      "targets": [
        "b_output_sum.in3"
      ],
      "route": {
        "style": "orthogonal",
        "source_xy": [
          855.0,
          275.0
        ],
        "target_xy": [
          1007.5,
          346.95
        ],
        "waypoints": [
          [
            855.0,
            346.95
          ]
        ],
        "stroke_width": 3
      }
    },
    {
      "id": "e_line_6",
      "source": "b_output_sum.out1",
      "target": "b_3_bit_quantizer.in1",
      "targets": [
        "b_3_bit_quantizer.in1"
      ],
      "route": {
        "style": "orthogonal",
        "source_xy": [
          1035.0,
          319.45
        ],
        "target_xy": [
          1070.0,
          319.45
        ],
        "waypoints": [],
        "stroke_width": 3
      }
    },
    {
      "id": "e_line_7",
      "source": "b_3_bit_quantizer.out1",
      "target": "b_to_workspace",
      "targets": [
        "b_to_workspace"
      ],
      "route": {
        "style": "orthogonal",
        "source_xy": [
          1165.0,
          319.45
        ],
        "target_xy": [
          1220.0,
          282.5
        ],
        "waypoints": [
          [
            1165.0,
            282.5
          ]
        ],
        "stroke_width": 3
      }
    },
    {
      "id": "e_line_8",
      "source": "b_unit_delay.out1",
      "target": "b_k1.in1",
      "targets": [
        "b_k1.in1"
      ],
      "route": {
        "style": "orthogonal",
        "source_xy": [
          525.0,
          275.0
        ],
        "target_xy": [
          365.0,
          319.45
        ],
        "waypoints": [
          [
            525.0,
            319.45
          ]
        ],
        "stroke_width": 3
      }
    },
    {